{
  "$schema": "https://raw.githubusercontent.com/Christopher-Schulze/reconc/reconc-v0.9.6/schemas/v1/harness-pack-manifest.schema.json",
  "format_version": "reconc.harness-pack/v1",
  "kind": "harness-pack",
  "name": "advanced",
  "version": "1.0.0",
  "product_compatibility": {
    "minimum": "0.9.0",
    "maximum_exclusive": "1.0.0"
  },
  "capabilities": [
    "advanced-audits",
    "architecture-scaffolds",
    "hook-scaffolds",
    "task-utilities"
  ],
  "files": [
    {
      "path": "tools/reconc/harness/template/BOOTSTRAP.md",
      "mode": 420,
      "size": 49721,
      "sha256": "b71f3e5f6fd1dad393c666a6a7af1125a3465bc41bc45a65fa8afd301d4fa869",
      "ownership": "pack-file"
    },
    {
      "path": "tools/reconc/harness/template/README.md",
      "mode": 420,
      "size": 1960,
      "sha256": "79223119cff3347ba55e3e1ca312c85f73fc684b3ae9698c7585c8df92d6e042",
      "ownership": "pack-file"
    },
    {
      "path": "tools/reconc/harness/template/audits/agent_quality.go",
      "mode": 420,
      "size": 8173,
      "sha256": "8b3780e4594283cce199d8d984668e3cebae704a1c6ec1df4d774df6bd5d9d0d",
      "ownership": "pack-file"
    },
    {
      "path": "tools/reconc/harness/template/audits/agent_quality_lex_test.go",
      "mode": 420,
      "size": 1377,
      "sha256": "c8bd2250738006ecfdf2b1364051ae245fdf53c68eb3292e06786a10e69fb7b8",
      "ownership": "pack-file"
    },
    {
      "path": "tools/reconc/harness/template/audits/agent_quality_test.go",
      "mode": 420,
      "size": 152,
      "sha256": "fa715f8eb7dea4a8256ecbd82351f2612136b281aa9a918caf40024d0ce22428",
      "ownership": "pack-file"
    },
    {
      "path": "tools/reconc/harness/template/audits/agents_md_mirror.go",
      "mode": 420,
      "size": 3150,
      "sha256": "b227e5a7869b15c883dad38c4b95ebb90adff8e6e96f2a45091708a7b18c26ad",
      "ownership": "pack-file"
    },
    {
      "path": "tools/reconc/harness/template/audits/agents_md_mirror_test.go",
      "mode": 420,
      "size": 5278,
      "sha256": "6e3951f3860005824c114032fd1cef05d8f1cfd4337683d7b7dfd65c47930da2",
      "ownership": "pack-file"
    },
    {
      "path": "tools/reconc/harness/template/audits/arch_lint.go",
      "mode": 420,
      "size": 8832,
      "sha256": "4fd845343586f3263a83acd6dbab02ada026821db1730c04885b2d44fa3fbd82",
      "ownership": "pack-file"
    },
    {
      "path": "tools/reconc/harness/template/audits/arch_lint_test.go",
      "mode": 420,
      "size": 4238,
      "sha256": "fd8161638fab2281274414347aa628518919fa93e03a3bc2f08464a7cffec327",
      "ownership": "pack-file"
    },
    {
      "path": "tools/reconc/harness/template/audits/audit_cache.go",
      "mode": 420,
      "size": 17596,
      "sha256": "c70fd3f611544d2d43ec3488874cbf38d09e5105baee82559daba1ea60bf317e",
      "ownership": "pack-file"
    },
    {
      "path": "tools/reconc/harness/template/audits/audit_cache_lock_unix.go",
      "mode": 420,
      "size": 309,
      "sha256": "4637c79fbc8a87c07bd722e89ce0f332c775d9b144f3bf774aab0048957f97f6",
      "ownership": "pack-file"
    },
    {
      "path": "tools/reconc/harness/template/audits/audit_cache_lock_windows.go",
      "mode": 420,
      "size": 1303,
      "sha256": "ef6a0b061e1b20e79574ac753b9967b38e1ce62ffa361ee3b97681f531fe02d6",
      "ownership": "pack-file"
    },
    {
      "path": "tools/reconc/harness/template/audits/audit_cache_test.go",
      "mode": 420,
      "size": 20840,
      "sha256": "3341bb1b94c6e017804a47a01ed92c4c4ed8ba5d0f43c091351f4bf2104362f4",
      "ownership": "pack-file"
    },
    {
      "path": "tools/reconc/harness/template/audits/audit_cache_unix_test.go",
      "mode": 420,
      "size": 2026,
      "sha256": "cb7ace585270af0e046edb39be02658a4d07335c86ded7309d8fa47337fbdb93",
      "ownership": "pack-file"
    },
    {
      "path": "tools/reconc/harness/template/audits/audit_cache_wrappers.go",
      "mode": 420,
      "size": 5460,
      "sha256": "3443b35a35eb0030de68f494f4bf5db5583c6c5d7d7ad877e07e241e187d5a41",
      "ownership": "pack-file"
    },
    {
      "path": "tools/reconc/harness/template/audits/audit_input.go",
      "mode": 420,
      "size": 2139,
      "sha256": "47b3ece91d825d3a8d1ec08b848dd2da52150b27383e3e10cbbbd9f0216c436a",
      "ownership": "pack-file"
    },
    {
      "path": "tools/reconc/harness/template/audits/command.go",
      "mode": 420,
      "size": 4142,
      "sha256": "591d704d665b86c612e26c1a066c2124307e21f7c9ed5101449bf04525ca947b",
      "ownership": "pack-file"
    },
    {
      "path": "tools/reconc/harness/template/audits/command_test.go",
      "mode": 420,
      "size": 5477,
      "sha256": "247a2fad1f079cd841c42b2ab2bb204970ae552cf9501b9bf623d18c77b0f251",
      "ownership": "pack-file"
    },
    {
      "path": "tools/reconc/harness/template/audits/coverage_depth_test.go",
      "mode": 420,
      "size": 38223,
      "sha256": "ba0f3fa06d2bc3d001fd4e87a349b37ef5f1b496eb4954a6426d51f96cfe8b43",
      "ownership": "pack-file"
    },
    {
      "path": "tools/reconc/harness/template/audits/exit_contract_test.go",
      "mode": 420,
      "size": 660,
      "sha256": "67ecb2b1f17093f6f58a968011418838977f1fec25007bfd2656472078bde21b",
      "ownership": "pack-file"
    },
    {
      "path": "tools/reconc/harness/template/audits/generated_reference/generated_reference_audit.go",
      "mode": 420,
      "size": 2519,
      "sha256": "7bcf9001a8cfbd02cf4f75b524cf1c4e115fb6a90077a2f9d38c6269e783af8e",
      "ownership": "pack-file"
    },
    {
      "path": "tools/reconc/harness/template/audits/generated_reference/generated_reference_audit_test.go",
      "mode": 420,
      "size": 3271,
      "sha256": "d21116ff81095444ebc627ff3352a8014e1445c956c43e75f79575801f6f170c",
      "ownership": "pack-file"
    },
    {
      "path": "tools/reconc/harness/template/audits/generated_reference/generated_reference_audit_unix_test.go",
      "mode": 420,
      "size": 666,
      "sha256": "f10f38855c277bdff9f7eab5956380b9c9e4002674f4692df727bc349475cbd5",
      "ownership": "pack-file"
    },
    {
      "path": "tools/reconc/harness/template/audits/hook_platform_audit_test.go",
      "mode": 420,
      "size": 11141,
      "sha256": "d6ac832cc4f5d1c90fbc21b47966e442c2004ce13e433fe8663f7c3c382c94e6",
      "ownership": "pack-file"
    },
    {
      "path": "tools/reconc/harness/template/audits/lib/donecheck/donecheck.go",
      "mode": 420,
      "size": 9518,
      "sha256": "30e83f6589c5d3a3434445e892f8782886da92702a503a5dc0cc4c4b382b1389",
      "ownership": "pack-file"
    },
    {
      "path": "tools/reconc/harness/template/audits/lib/donecheck/donecheck_test.go",
      "mode": 420,
      "size": 9685,
      "sha256": "65ee8deb54c6251e57f5feb23e9b3cc84f1ba6030670ef62cd48d11e4d8005dc",
      "ownership": "pack-file"
    },
    {
      "path": "tools/reconc/harness/template/audits/lib/donecheck/schema.go",
      "mode": 420,
      "size": 7491,
      "sha256": "d926c39f121a777b32169279d8b46da1481f70a1b1ff7fcfe964d01735d15a84",
      "ownership": "pack-file"
    },
    {
      "path": "tools/reconc/harness/template/audits/lib/donecheck/schema_test.go",
      "mode": 420,
      "size": 4334,
      "sha256": "132cbd17905e1eb74cc304cf38e758cbddd1fdd21970c1edbfd690a469d6c039",
      "ownership": "pack-file"
    },
    {
      "path": "tools/reconc/harness/template/audits/lib/donecheck/schema_unix_test.go",
      "mode": 420,
      "size": 548,
      "sha256": "7d74c0a95536d04c4aae90ae88b3a2dde11282f3183596e5b0ba612b2ee0c1b6",
      "ownership": "pack-file"
    },
    {
      "path": "tools/reconc/harness/template/audits/lib/prune/coverage_depth_test.go",
      "mode": 420,
      "size": 3684,
      "sha256": "b8e94a62c1cb2912eb5170fc785820a51eb1038c9af93fe33e6aa5497c294c9e",
      "ownership": "pack-file"
    },
    {
      "path": "tools/reconc/harness/template/audits/lib/prune/prune.go",
      "mode": 420,
      "size": 23376,
      "sha256": "aa77271e6438d2bc9a9203b521ecc33f22711830aa11df84a0c3cb3ece609d65",
      "ownership": "pack-file"
    },
    {
      "path": "tools/reconc/harness/template/audits/lib/prune/prune_test.go",
      "mode": 420,
      "size": 14295,
      "sha256": "ea5a9a0d781bbcacc810be84085a071b04c4d1d0a81b9855a78737bb9fcf2e34",
      "ownership": "pack-file"
    },
    {
      "path": "tools/reconc/harness/template/audits/lib/prune/safety_test.go",
      "mode": 420,
      "size": 780,
      "sha256": "8bf4cba1c144165d3f6b580a110db21c1527344ef8613ccd781f230f8bd032b2",
      "ownership": "pack-file"
    },
    {
      "path": "tools/reconc/harness/template/audits/lib/prune/safety_unix_test.go",
      "mode": 420,
      "size": 3036,
      "sha256": "d9dde46da304b51d166c6c3d131a2ea5a223c8ea7ab21876bbbcbd1043547f1b",
      "ownership": "pack-file"
    },
    {
      "path": "tools/reconc/harness/template/audits/lib/reconcbinary/binary.go",
      "mode": 420,
      "size": 8005,
      "sha256": "4e2e216cc6ab672a1c2f7b8c4b6dfbb59c3dfc3dc5ff4a51ac6216af962d36b1",
      "ownership": "pack-file"
    },
    {
      "path": "tools/reconc/harness/template/audits/line_count_test.go",
      "mode": 420,
      "size": 1015,
      "sha256": "8da9712628776bd8db8ab745ab04a4eb759f2d09e658c19cb51e5520ba4b639d",
      "ownership": "pack-file"
    },
    {
      "path": "tools/reconc/harness/template/audits/module_lint.go",
      "mode": 420,
      "size": 7274,
      "sha256": "22fa153427d2dc361531108b14a91ac9aaf769619dbefe7e9ff43b95913c4921",
      "ownership": "pack-file"
    },
    {
      "path": "tools/reconc/harness/template/audits/module_lint_test.go",
      "mode": 420,
      "size": 2146,
      "sha256": "1ac9a847c4f53ff141a00e170ce7fc3fc5953b372b38ef7d56c60f0d8a291983",
      "ownership": "pack-file"
    },
    {
      "path": "tools/reconc/harness/template/audits/run-workflow-audit",
      "mode": 493,
      "size": 3694,